{
  "$schema": "../schema/app.schema.json",
  "slug": "care_kutumba_fe",
  "name": "CARE Kutumba",
  "description": "Kutumba integration plugin for CARE. Enables integration with Karnataka's Kutumba family database system for patient identification and demographic data exchange.",
  "featured": false,
  "iconUrl": "../assets/care-kutumba.svg",
  "developer": {
    "slug": "ohcnetwork",
    "name": "Open Healthcare Network",
    "url": "https://github.com/ohcnetwork"
  },
  "categories": [
    {
      "slug": "integrations",
      "name": "Integrations",
      "description": "Apps that connect CARE to external services."
    }
  ],
  "baseConfig": {
    "url": "https://care-kutumba-fe.pages.dev/assets/remoteEntry.js",
    "name": "care_kutumba_fe",
    "plug": "care_kutumba_fe"
  },
  "healthCheck": {
    "url": "{{appBaseUrl}}/assets/remoteEntry.js",
    "method": "GET",
    "successStatus": 200
  },
  "source": {
    "repository": "https://github.com/10bedicu/care_kutumba_fe",
    "appBaseUrl": "http://localhost:11111"
  },
  "standardConfigurations": [
    {
      "id": "local-dev",
      "title": "Local development",
      "description": "Attach the local preview output from care_kutumba_fe for development and manual testing.",
      "config": {
        "mode": "local"
      },
      "appBaseUrl": {
        "label": "App base URL",
        "description": "Base URL where the frontend plug is served.",
        "defaultValue": "http://localhost:11111"
      },
      "environments": {
        "mandatory": [
          {
            "key": "REACT_KUTUMBA_BPL_TAG_ID",
            "label": "BPL tag ID",
            "description": "Tag ID applied for Kutumba rc_type values BPL and PHH. Source from /api/v1/tag_config/."
          },
          {
            "key": "REACT_KUTUMBA_APL_TAG_ID",
            "label": "APL tag ID",
            "description": "Tag ID applied for Kutumba rc_type values APL and NPHH. Source from /api/v1/tag_config/."
          },
          {
            "key": "REACT_KUTUMBA_RC_NUMBER_IDENTIFIER_ID",
            "label": "RC number identifier ID",
            "description": "Patient identifier config ID where the Kutumba ration card number is stored."
          }
        ],
        "defaults": [
          {
            "key": "REACT_KUTUMBA_AUTO_SUBMIT_ON_FILL",
            "label": "Auto-submit on fill",
            "description": "Auto-submit the registration form after filling from Kutumba. Set to \"true\" to enable.",
            "defaultValue": "false"
          }
        ],
        "optional": [
          {
            "key": "REACT_KUTUMBA_HEALTH_ID_IDENTIFIER_ID",
            "label": "Health ID identifier ID",
            "description": "Optional, not used in production. Patient identifier config ID for storing the Kutumba Health ID. Leave blank to skip."
          },
          {
            "key": "REACT_KUTUMBA_EDUCATION_ID_IDENTIFIER_ID",
            "label": "Education ID identifier ID",
            "description": "Optional, not used in production. Patient identifier config ID for storing the Kutumba Education ID. Leave blank to skip."
          },
          {
            "key": "REACT_KUTUMBA_STUDENT_UNVERIFIED_TAG_ID",
            "label": "Student (unverified) tag ID",
            "description": "Exploratory, not used in production. Tag applied silently when a Kutumba member has an education_id."
          },
          {
            "key": "REACT_KUTUMBA_PWD_UNVERIFIED_TAG_ID",
            "label": "PWD (unverified) tag ID",
            "description": "Exploratory, not used in production. Tag applied silently when a Kutumba member has a disability_applicant_no."
          }
        ],
        "custom": {
          "enabled": true,
          "label": "Custom environments",
          "description": "Add extra environment variables for advanced setup."
        }
      }
    },
    {
      "id": "production",
      "title": "Production",
      "description": "Production configuration for care_kutumba_fe with the minimum required environment variables.",
      "config": {
        "mode": "production"
      },
      "appBaseUrl": {
        "label": "App base URL",
        "description": "Base URL where the frontend plug is served.",
        "defaultValue": "https://develop.care-kutumba-fe.pages.dev"
      },
      "environments": {
        "mandatory": [
          {
            "key": "REACT_KUTUMBA_BPL_TAG_ID",
            "label": "BPL tag ID",
            "description": "Tag ID applied for Kutumba rc_type values BPL and PHH. Source from /api/v1/tag_config/."
          },
          {
            "key": "REACT_KUTUMBA_APL_TAG_ID",
            "label": "APL tag ID",
            "description": "Tag ID applied for Kutumba rc_type values APL and NPHH. Source from /api/v1/tag_config/."
          },
          {
            "key": "REACT_KUTUMBA_RC_NUMBER_IDENTIFIER_ID",
            "label": "RC number identifier ID",
            "description": "Patient identifier config ID where the Kutumba ration card number is stored."
          }
        ],
        "defaults": [
          {
            "key": "REACT_KUTUMBA_AUTO_SUBMIT_ON_FILL",
            "label": "Auto-submit on fill",
            "description": "Auto-submit the registration form after filling from Kutumba. Set to \"true\" to enable.",
            "defaultValue": "false"
          }
        ],
        "optional": [],
        "custom": {
          "enabled": true,
          "label": "Custom environments",
          "description": "Add extra environment variables for advanced setup."
        }
      }
    }
  ],
  "rawSetup": {
    "id": "raw-setup",
    "title": "Raw setup",
    "description": "Start with a minimal plug_config and edit it directly.",
    "config": {
      "mode": "manual"
    },
    "appBaseUrl": {
      "label": "App base URL",
      "defaultValue": "https://develop.care-kutumba-fe.pages.dev"
    },
    "environments": {
      "mandatory": [],
      "defaults": [],
      "custom": {
        "enabled": true,
        "label": "Custom environments"
      }
    }
  }
}
