{
  "$schema": "../schema/app.schema.json",
  "slug": "care_teleicu_devices_fe",
  "name": "CARE TeleICU Devices",
  "description": "CARE plugin that enables integration with TeleICU based devices such as Gateway, ONVIF Cameras, and Vitals Observation Devices (HL7 Monitors) for remote ICU monitoring.",
  "featured": true,
  "iconUrl": "../assets/care-teleicu-devices.svg",
  "developer": {
    "slug": "ohcnetwork",
    "name": "Open Healthcare Network",
    "url": "https://github.com/ohcnetwork"
  },
  "categories": [
    {
      "slug": "integrations",
      "name": "Integrations",
      "description": "Apps that connect CARE to external services."
    }
  ],
  "baseConfig": {
    "url": "https://care-teleicu-devices-fe.pages.dev/assets/remoteEntry.js",
    "name": "care_teleicu_devices_fe",
    "plug": "care_teleicu_devices_fe"
  },
  "healthCheck": {
    "url": "{{appBaseUrl}}/assets/remoteEntry.js",
    "method": "GET",
    "successStatus": 200
  },
  "source": {
    "repository": "https://github.com/ohcnetwork/care_teleicu_devices_fe",
    "appBaseUrl": "http://localhost:10120"
  },
  "standardConfigurations": [
    {
      "id": "local-dev",
      "title": "Local development",
      "description": "Attach the local preview output from care_teleicu_devices_fe for development and manual testing.",
      "config": {
        "mode": "local"
      },
      "appBaseUrl": {
        "label": "App base URL",
        "description": "Base URL where the frontend plug is served.",
        "defaultValue": "http://localhost:10120"
      },
      "environments": {
        "mandatory": [],
        "defaults": [],
        "optional": [],
        "custom": {
          "enabled": false
        }
      }
    },
    {
      "id": "production",
      "title": "Production",
      "description": "Attach the production output from care_teleicu_devices_fe for live usage.",
      "config": {
        "mode": "production"
      },
      "appBaseUrl": {
        "label": "App base URL",
        "description": "Base URL where the frontend plug is served.",
        "defaultValue": "https://care-teleicu-devices-fe.pages.dev"
      },
      "environments": {
        "mandatory": [],
        "defaults": [],
        "optional": [],
        "custom": {
          "enabled": false
        }
      }
    }
  ],
  "rawSetup": {
    "id": "raw-setup",
    "title": "Raw setup",
    "description": "Start with a minimal plug_config and edit it directly.",
    "config": {
      "mode": "manual"
    },
    "appBaseUrl": {
      "label": "App base URL",
      "defaultValue": "https://care-teleicu-devices-fe.pages.dev"
    },
    "environments": {
      "mandatory": [],
      "defaults": [],
      "custom": {
        "enabled": false
      }
    }
  }
}
