{
  "$schema": "../schema/app.schema.json",
  "slug": "care_imports_fe",
  "name": "CARE Imports",
  "description": "Bulk data import and export plugin for CARE. Helps hospital administrators set up facilities by importing users, departments, locations, medications, lab tests, and more from CSV files with validation and review workflows.",
  "featured": true,
  "iconUrl": "../assets/care-imports.svg",
  "developer": {
    "slug": "ohcnetwork",
    "name": "Open Healthcare Network",
    "url": "https://github.com/ohcnetwork"
  },
  "categories": [
    {
      "slug": "productivity",
      "name": "Productivity",
      "description": "Admin-facing tools and workflow accelerators."
    }
  ],
  "baseConfig": {
    "url": "https://care-imports.ohc.network/assets/remoteEntry.js",
    "name": "care_imports_fe",
    "plug": "care_imports_fe"
  },
  "source": {
    "repository": "https://github.com/ohcnetwork/care_imports_fe",
    "appBaseUrl": "http://localhost:5173"
  },
  "standardConfigurations": [
    {
      "id": "local-dev",
      "title": "Local development",
      "description": "Attach the local preview output from care_imports_fe for development and manual testing.",
      "config": {
        "mode": "local"
      },
      "appBaseUrl": {
        "label": "App base URL",
        "description": "Base URL where the frontend plug is served.",
        "defaultValue": "http://localhost:5173"
      },
      "environments": {
        "mandatory": [],
        "defaults": [],
        "optional": [],
        "custom": {
          "enabled": true,
          "label": "Custom environments",
          "description": "Add extra environment variables for advanced setup."
        }
      }
    }
  ],
  "rawSetup": {
    "id": "raw-setup",
    "title": "Raw setup",
    "description": "Start with a minimal plug_config and edit it directly.",
    "config": {
      "mode": "manual"
    },
    "appBaseUrl": {
      "label": "App base URL",
      "defaultValue": "https://care-imports.ohc.network"
    },
    "environments": {
      "mandatory": [],
      "defaults": [],
      "custom": {
        "enabled": true,
        "label": "Custom environments"
      }
    }
  }
}
