{
  "$schema": "../schema/app.schema.json",
  "slug": "care_doctor_connect_fe",
  "name": "CARE Doctor Connect",
  "description": "Doctor directory and connection plugin for CARE. Enables searching and connecting with healthcare providers across facilities and organizations.",
  "featured": false,
  "iconUrl": "../assets/care-doctor-connect.svg",
  "developer": {
    "slug": "ohcnetwork",
    "name": "Open Healthcare Network",
    "url": "https://github.com/ohcnetwork"
  },
  "categories": [
    {
      "slug": "productivity",
      "name": "Productivity",
      "description": "Admin-facing tools and workflow accelerators."
    }
  ],
  "baseConfig": {
    "url": "https://care-doctor-connect.ohc.network/assets/remoteEntry.js",
    "name": "care_doctor_connect_fe",
    "plug": "care_doctor_connect_fe"
  },
  "source": {
    "repository": "https://github.com/ohcnetwork/care_doctor_connect_fe",
    "appBaseUrl": "http://localhost:5173"
  },
  "standardConfigurations": [
    {
      "id": "local-dev",
      "title": "Local development",
      "description": "Attach the local preview output from care_doctor_connect_fe for development and manual testing.",
      "config": {
        "mode": "local",
        "allowed_filter_roles": ["Doctor"]
      },
      "appBaseUrl": {
        "label": "App base URL",
        "description": "Base URL where the frontend plug is served.",
        "defaultValue": "http://localhost:5173"
      },
      "environments": {
        "mandatory": [],
        "defaults": [],
        "optional": [
          {
            "key": "allowed_facility_organizations",
            "label": "Allowed facility organizations",
            "description": "Optional list of facility organization IDs the directory is restricted to. Leave empty for no restriction.",
            "type": "string[]",
            "path": "meta.config.allowed_facility_organizations"
          },
          {
            "key": "allowed_filter_roles",
            "label": "Allowed filter roles",
            "description": "Optional list of role names users can filter providers by.",
            "type": "string[]",
            "path": "meta.config.allowed_filter_roles"
          }
        ],
        "custom": {
          "enabled": true,
          "label": "Custom environments",
          "description": "Add extra environment variables for advanced setup."
        }
      }
    }
  ],
  "rawSetup": {
    "id": "raw-setup",
    "title": "Raw setup",
    "description": "Start with a minimal plug_config and edit it directly.",
    "config": {
      "mode": "manual"
    },
    "appBaseUrl": {
      "label": "App base URL",
      "defaultValue": "https://care-doctor-connect.ohc.network"
    },
    "environments": {
      "mandatory": [],
      "defaults": [],
      "optional": [
        {
          "key": "allowed_facility_organizations",
          "label": "Allowed facility organizations",
          "description": "Optional list of facility organization IDs the directory is restricted to.",
          "type": "string[]",
          "path": "meta.config.allowed_facility_organizations"
        },
        {
          "key": "allowed_filter_roles",
          "label": "Allowed filter roles",
          "description": "Optional list of role names users can filter providers by.",
          "type": "string[]",
          "path": "meta.config.allowed_filter_roles"
        }
      ],
      "custom": {
        "enabled": true,
        "label": "Custom environments"
      }
    }
  }
}
